{
  "schema_version": "0.1",
  "source": {
    "module": "payload_sources",
    "artifact_path": "reports\\acceptance\\2026-09-11-abc\\run\\payloads\\payloads\\payload-download-01-d8f9c37a5714-tcp-stream-0-node1_to_node0-0000.bin",
    "artifact_sha256": "215ff970eee6a68f5e5a27bef8bea4026824a1e45d2c6024e79812617dee7c07",
    "record_id": "payload-download-01-d8f9c37a5714-tcp-stream-0-node1_to_node0-0000"
  },
  "status": "ok",
  "parameters": {
    "max_input_bytes": 67108864,
    "max_depth": 3,
    "max_output_bytes": 8388608,
    "max_inflation_ratio": 100.0,
    "max_artifacts": 32,
    "min_printable_length": 4,
    "enabled_decoders": [
      "utf8",
      "utf16",
      "hex",
      "base64",
      "gzip",
      "zlib"
    ],
    "source_basis": "protocol_declared",
    "source_completeness": "complete"
  },
  "recoveries": [
    {
      "recovery_id": "m08-215ff970eee6-0000",
      "source_ref": {
        "module": "payload_sources",
        "artifact_path": "reports\\acceptance\\2026-09-11-abc\\run\\payloads\\payloads\\payload-download-01-d8f9c37a5714-tcp-stream-0-node1_to_node0-0000.bin",
        "artifact_sha256": "215ff970eee6a68f5e5a27bef8bea4026824a1e45d2c6024e79812617dee7c07",
        "record_id": "payload-download-01-d8f9c37a5714-tcp-stream-0-node1_to_node0-0000"
      },
      "source_range": {
        "start": 0,
        "end": 101
      },
      "basis": "protocol_declared",
      "transformation_chain": [
        {
          "operation": "utf8",
          "input_length": 101,
          "output_length": 101,
          "parameters": {},
          "validation": "strict_decode"
        }
      ],
      "output": {
        "artifact_ref": "recovered/m08-215ff970eee6-0000.bin",
        "sha256": "215ff970eee6a68f5e5a27bef8bea4026824a1e45d2c6024e79812617dee7c07",
        "length": 101,
        "media_type": "text/plain; charset=utf8"
      },
      "completeness": "complete",
      "evidence": [
        "strict validation completed for every recorded transformation"
      ],
      "source_ranges": [
        {
          "start": 252,
          "end": 353
        }
      ],
      "source_context": {
        "payload_sources_path": "reports\\acceptance\\2026-09-11-abc\\run\\payloads\\payload_sources.json",
        "payload_sources_sha256": "64fa82b83463c0163046f6f012115b9920df0341041a4bea1e7e1a7849f88d8f",
        "protocol": "http",
        "recognition_basis": "strict_http_start_line_and_framing_headers",
        "stream_id": "download-01-d8f9c37a5714-tcp-stream-0",
        "flow_id": "download-01-d8f9c37a5714-tcp-flow-0",
        "direction": "node1_to_node0",
        "message_index": 0,
        "framing": "content_length",
        "content_encoding": null
      }
    }
  ],
  "failed_attempts": [],
  "skipped_sources": [],
  "metrics": {
    "recovery_count": 1,
    "failed_attempt_count": 0,
    "skipped_source_count": 0,
    "output_bytes": 101
  },
  "warnings": [
    "Successful decoding or decompression does not establish application semantics."
  ]
}
