{
  "schema_version": "0.1",
  "source": {
    "module": "payload_sources",
    "artifact_path": "data\\acceptance\\frozen-20260910\\integration\\payloads\\payloads\\payload-download-01-d8f9c37a5714-tcp-stream-0-node1_to_node0-0000.bin",
    "artifact_sha256": "215ff970eee6a68f5e5a27bef8bea4026824a1e45d2c6024e79812617dee7c07",
    "record_id": "payload-download-01-d8f9c37a5714-tcp-stream-0-node1_to_node0-0000"
  },
  "status": "ok",
  "parameters": {
    "max_input_bytes": 67108864,
    "max_depth": 3,
    "max_output_bytes": 8388608,
    "max_inflation_ratio": 100.0,
    "max_artifacts": 32,
    "min_printable_length": 4,
    "enabled_decoders": [
      "utf8",
      "utf16",
      "hex",
      "base64",
      "gzip",
      "zlib"
    ]
  },
  "recoveries": [
    {
      "recovery_id": "m08-215ff970eee6-0000",
      "source_ref": {
        "module": "payload_sources",
        "artifact_path": "data\\acceptance\\frozen-20260910\\integration\\payloads\\payloads\\payload-download-01-d8f9c37a5714-tcp-stream-0-node1_to_node0-0000.bin",
        "artifact_sha256": "215ff970eee6a68f5e5a27bef8bea4026824a1e45d2c6024e79812617dee7c07",
        "record_id": "payload-download-01-d8f9c37a5714-tcp-stream-0-node1_to_node0-0000"
      },
      "source_range": {
        "start": 0,
        "end": 101
      },
      "basis": "strict_candidate",
      "transformation_chain": [
        {
          "operation": "utf8",
          "input_length": 101,
          "output_length": 101,
          "parameters": {},
          "validation": "strict_decode"
        }
      ],
      "output": {
        "artifact_ref": "recovered/m08-215ff970eee6-0000.bin",
        "sha256": "215ff970eee6a68f5e5a27bef8bea4026824a1e45d2c6024e79812617dee7c07",
        "length": 101,
        "media_type": "text/plain; charset=utf8"
      },
      "completeness": "candidate",
      "evidence": [
        "strict validation completed for every recorded transformation"
      ]
    }
  ],
  "failed_attempts": [],
  "skipped_sources": [],
  "metrics": {
    "recovery_count": 1,
    "failed_attempt_count": 0,
    "skipped_source_count": 0,
    "output_bytes": 101
  },
  "warnings": [
    "Successful decoding or decompression does not establish application semantics."
  ]
}
